{
  "$schema": "./dayPillars.schema.json",
  "version": "1.0.0",
  "lastUpdated": "2026-01-03",
  "description": "60일주 해석 데이터 (명리학 서적 기반)",
  "sources": ["적천수(滴天髓)", "궁통보감(窮通寶鑑)", "자평진전(子平眞詮)", "연해자평(淵海子平)"],
  "data": {
    "경자": {
      "name": "경자",
      "hanja": "庚子",
      "stem": "경",
      "branch": "자",
      "keywords": [
        {
          "term": "금수쌍청",
          "hanja": "金水雙淸",
          "source": "적천수",
          "meaning": "금과 물이 함께 맑음"
        },
        {
          "term": "금한수냉",
          "hanja": "金寒水冷",
          "source": "궁통보감",
          "meaning": "금이 차고 물이 냉함"
        },
        {
          "term": "식신좌하",
          "hanja": "食神坐下",
          "source": "자평진전",
          "meaning": "일지에 식신이 앉음"
        }
      ],
      "basic": {
        "summary": "경금(庚金)이 자수(子水) 위에 앉은 금수쌍청(金水雙淸)의 일주입니다.",
        "description": "경자일주(庚子日柱)는 강인한 쇠(庚金)가 맑은 물(子水)과 만나 청명한 기운을 형성합니다. 경금은 원석, 광물, 날카로운 도구를 상징하며, 자수는 겨울의 북방수로 지혜와 총명함을 나타냅니다. 일지의 자수는 경금의 식신(食神)에 해당하여, 재능과 표현력이 자연스럽게 흘러나옵니다."
      },
      "personality": {
        "strengths": [
          "총명하고 분석력이 뛰어남",
          "논리적이고 객관적인 판단력",
          "재능이 풍부하고 창의적",
          "결단력과 추진력이 강함"
        ],
        "weaknesses": [
          "차가운 인상을 줄 수 있음",
          "비판적 성향이 강할 수 있음",
          "감정 표현이 서툴 수 있음",
          "고집이 셀 수 있음"
        ],
        "description": "경자일주는 이성적이고 분석적인 성격의 소유자입니다. 식신의 기운으로 재능이 풍부하고 표현력이 좋으나, 금한수냉(金寒水冷)의 기운으로 인해 차가운 인상을 줄 수 있습니다. 논리적 사고를 중시하며, 감정보다 이성으로 상황을 판단하는 경향이 있습니다."
      },
      "career": {
        "suitable": [
          "IT/소프트웨어 개발",
          "금융/투자 분석",
          "연구/학술 분야",
          "법률/컨설팅",
          "교육/강의",
          "기획/전략"
        ],
        "unsuitable": [
          "감정 노동이 많은 서비스업",
          "즉흥적 판단이 필요한 분야"
        ],
        "description": "식신의 기운이 강해 분석력과 논리력을 활용하는 분야에서 두각을 나타냅니다. 특히 복잡한 문제를 체계적으로 풀어나가는 IT, 금융, 연구 분야에 적합합니다. 금생수(金生水)의 흐름으로 창작과 교육 분야에서도 재능을 발휘할 수 있습니다."
      },
      "relationship": {
        "traits": [
          "신뢰할 수 있는 조언자 역할",
          "객관적이고 공정한 태도",
          "깊은 관계를 선호",
          "쉽게 마음을 열지 않음"
        ],
        "description": "경자일주는 대인관계에서 신중하고 객관적인 태도를 유지합니다. 쉽게 친해지지 않지만, 일단 관계가 형성되면 깊고 오래가는 우정을 쌓습니다. 논리적이고 공정한 성격으로 주변에서 조언을 구하는 일이 많습니다."
      },
      "advice": {
        "leverageStrength": "뛰어난 분석력과 논리력을 활용하여 전문 분야에서 권위자로 성장하세요. 식신의 재능으로 자신만의 콘텐츠나 지식을 창출할 수 있습니다.",
        "caution": "금한수냉의 기운으로 차가운 인상을 줄 수 있으니, 의식적으로 따뜻함을 표현하려 노력하세요. 지나친 비판은 관계를 해칠 수 있습니다.",
        "action": "화(火) 기운을 보완하면 좋습니다. 붉은 계열의 색상, 따뜻한 취미 활동, 사람들과의 교류를 통해 균형을 맞추세요."
      },
      "meta": {
        "polarity": "yang",
        "stemElement": "금",
        "branchElement": "수",
        "branchTenGod": "식신"
      }
    },
    "갑진": {
      "name": "갑진",
      "hanja": "甲辰",
      "stem": "갑",
      "branch": "진",
      "keywords": [
        {
          "term": "동량지재",
          "hanja": "棟梁之材",
          "source": "적천수",
          "meaning": "집의 대들보가 될 인재"
        },
        {
          "term": "갑목기진",
          "hanja": "甲木騎辰",
          "source": "자평진전",
          "meaning": "갑목이 진토를 타고 앉음"
        },
        {
          "term": "편재좌하",
          "hanja": "偏財坐下",
          "source": "자평진전",
          "meaning": "일지에 편재가 앉음"
        }
      ],
      "basic": {
        "summary": "갑목(甲木)이 진토(辰土) 위에 앉은 동량지재(棟梁之材)의 일주입니다.",
        "description": "갑진일주(甲辰日柱)는 큰 나무(甲木)가 습한 봄의 땅(辰土) 위에 뿌리를 내린 형상입니다. 갑목은 소나무, 삼나무처럼 곧게 자라는 대목(大木)을 상징하며, 리더십과 성장력을 나타냅니다. 진토는 봄의 습토로 나무를 기르는 역할을 하여 뿌리가 튼튼합니다. 일지에 편재(辰 중 戊土)가 있어 재물복이 있고 사업 수완이 뛰어납니다."
      },
      "personality": {
        "strengths": [
          "리더십이 뛰어남",
          "성장 지향적이고 진취적",
          "재물을 모으는 능력이 있음",
          "책임감이 강하고 신뢰할 수 있음"
        ],
        "weaknesses": [
          "고집이 셀 수 있음",
          "융통성이 부족할 때가 있음",
          "완벽주의 경향",
          "변화를 받아들이기 어려울 수 있음"
        ],
        "description": "갑진일주는 정직하고 곧은 성품을 가진 리더형입니다. 나무가 곧게 자라듯 원칙을 중시하며, 주변에서 기둥 같은 존재로 인식됩니다. 편재의 기운으로 재물에 대한 감각이 있으나, 지나친 고집은 유연성을 해칠 수 있습니다."
      },
      "career": {
        "suitable": [
          "경영/사업",
          "부동산/건설",
          "금융/투자",
          "공직/행정",
          "교육/멘토링",
          "컨설팅"
        ],
        "unsuitable": [
          "단순 반복 업무",
          "창의성보다 순응이 필요한 분야"
        ],
        "description": "동량지재의 기운으로 조직을 이끌거나 사업을 경영하는 분야에서 두각을 나타냅니다. 편재가 일지에 있어 재물을 다루는 금융, 부동산 분야에도 적합합니다. 리더십을 발휘할 수 있는 위치에서 능력을 펼칠 수 있습니다."
      },
      "relationship": {
        "traits": [
          "든든한 버팀목 역할",
          "책임감 있는 태도",
          "보호자적 성향",
          "때로는 독선적일 수 있음"
        ],
        "description": "갑진일주는 관계에서 든든한 지지자 역할을 합니다. 책임감이 강해 맡은 바를 끝까지 해내며, 주변 사람들에게 신뢰받습니다. 다만, 자신의 방식을 고수하려는 경향이 있어 상대방의 의견도 존중하는 자세가 필요합니다."
      },
      "advice": {
        "leverageStrength": "타고난 리더십과 재물 복을 활용하여 조직을 이끌거나 사업을 운영하세요. 성장 지향적 성격으로 꾸준히 발전할 수 있습니다.",
        "caution": "고집과 완벽주의가 지나치면 주변과 마찰이 생길 수 있습니다. 유연성을 기르고 다른 의견도 수용하는 열린 마음이 필요합니다.",
        "action": "수(水) 기운을 보완하면 좋습니다. 물과 관련된 활동이나 겸손함을 키우는 것이 균형에 도움됩니다."
      },
      "meta": {
        "polarity": "yang",
        "stemElement": "목",
        "branchElement": "토",
        "branchTenGod": "편재"
      }
    },
    "병오": {
      "name": "병오",
      "hanja": "丙午",
      "stem": "병",
      "branch": "오",
      "keywords": [
        {
          "term": "양인좌하",
          "hanja": "羊刃坐下",
          "source": "적천수",
          "meaning": "일지에 양인이 앉음"
        },
        {
          "term": "일출천지",
          "hanja": "日出天地",
          "source": "궁통보감",
          "meaning": "해가 천지에 떠오름"
        },
        {
          "term": "화염충천",
          "hanja": "火炎沖天",
          "source": "적천수",
          "meaning": "불꽃이 하늘을 찌름"
        }
      ],
      "basic": {
        "summary": "병화(丙火)가 오화(午火) 위에 앉은 화염충천(火炎沖天)의 일주입니다.",
        "description": "병오일주(丙午日柱)는 태양(丙火)이 한낮(午時)에 가장 밝게 빛나는 형상입니다. 사주에서 가장 강렬한 화기(火氣)를 가진 일주로, 열정적이고 화려한 존재감을 드러냅니다. 양인(羊刃)인 오화가 일지에 있어 강한 자존심과 추진력을 가지며, 무대 위에서 빛나는 타입입니다."
      },
      "personality": {
        "strengths": [
          "열정적이고 에너지가 넘침",
          "카리스마와 리더십이 강함",
          "화려하고 주목받는 존재감",
          "추진력과 결단력이 뛰어남"
        ],
        "weaknesses": [
          "성격이 급할 수 있음",
          "자존심이 강해 충돌이 생길 수 있음",
          "감정 기복이 클 수 있음",
          "참을성이 부족할 때가 있음"
        ],
        "description": "병오일주는 불꽃처럼 열정적이고 밝은 성격입니다. 어디서든 중심에 서려는 성향이 있으며, 카리스마로 사람들을 이끕니다. 양인의 기운으로 강한 자존심과 추진력을 가지지만, 지나친 화기는 조절이 필요합니다."
      },
      "career": {
        "suitable": [
          "연예/방송",
          "정치/사회운동",
          "영업/마케팅",
          "스포츠/체육",
          "교육/강연",
          "창업/사업"
        ],
        "unsuitable": [
          "조용하고 은밀한 업무",
          "인내심이 많이 필요한 분야"
        ],
        "description": "화염충천의 기운으로 무대 위에서 빛나는 분야에 적합합니다. 연예, 방송, 정치 등 대중 앞에 서는 직업에서 능력을 발휘합니다. 강한 추진력으로 영업, 창업 분야에서도 성공할 수 있습니다."
      },
      "relationship": {
        "traits": [
          "따뜻하고 열정적인 표현",
          "중심이 되려는 성향",
          "솔직하고 직설적",
          "갈등 시 격해질 수 있음"
        ],
        "description": "병오일주는 관계에서 따뜻하고 열정적입니다. 솔직하게 감정을 표현하며, 주변을 밝게 만드는 에너지가 있습니다. 다만, 자존심이 강해 갈등 상황에서 격해질 수 있으니 감정 조절이 필요합니다."
      },
      "advice": {
        "leverageStrength": "타고난 카리스마와 열정을 활용하여 리더십을 발휘하세요. 무대 위에서 빛나는 분야에서 성공할 수 있습니다.",
        "caution": "화기가 과하면 성급함과 충돌로 이어질 수 있습니다. 인내심을 기르고 감정을 조절하는 연습이 필요합니다.",
        "action": "수(水) 기운을 보완하면 좋습니다. 물가에서 시간을 보내거나, 명상과 같은 차분한 활동으로 균형을 맞추세요."
      },
      "meta": {
        "polarity": "yang",
        "stemElement": "화",
        "branchElement": "화",
        "branchTenGod": "양인"
      }
    },
    "임자": {
      "name": "임자",
      "hanja": "壬子",
      "stem": "임",
      "branch": "자",
      "keywords": [
        {
          "term": "대해지수",
          "hanja": "大海之水",
          "source": "적천수",
          "meaning": "큰 바다의 물"
        },
        {
          "term": "양인좌하",
          "hanja": "羊刃坐下",
          "source": "자평진전",
          "meaning": "일지에 양인이 앉음"
        },
        {
          "term": "수왕극화",
          "hanja": "水旺剋火",
          "source": "궁통보감",
          "meaning": "물이 왕성하여 불을 극함"
        }
      ],
      "basic": {
        "summary": "임수(壬水)가 자수(子水) 위에 앉은 대해지수(大海之水)의 일주입니다.",
        "description": "임자일주(壬子日柱)는 큰 바다(壬水)가 깊은 밤(子時)의 물과 만나 거대한 수기(水氣)를 형성합니다. 임수는 대해(大海)의 물로 포용력과 지혜를 상징하며, 자수는 북방의 양인(羊刃)으로 강한 의지와 결단력을 나타냅니다. 총명하고 직관력이 뛰어나며, 학문과 예술에 재능이 있습니다."
      },
      "personality": {
        "strengths": [
          "포용력과 아량이 넓음",
          "총명하고 직관력이 뛰어남",
          "강한 의지와 결단력",
          "학문과 예술에 재능"
        ],
        "weaknesses": [
          "감정 기복이 있을 수 있음",
          "우울해지기 쉬움",
          "고집이 셀 때가 있음",
          "차가운 인상을 줄 수 있음"
        ],
        "description": "임자일주는 바다처럼 넓은 마음을 가진 지혜로운 성격입니다. 양인의 기운으로 강한 의지력과 결단력을 갖추고 있으며, 직관력이 뛰어나 상황을 빠르게 파악합니다. 다만, 물의 기운이 강해 감정 기복을 조절하는 것이 중요합니다."
      },
      "career": {
        "suitable": [
          "학술/연구",
          "예술/창작",
          "철학/종교",
          "심리/상담",
          "IT/기획",
          "물류/무역"
        ],
        "unsuitable": [
          "정형화된 단순 업무",
          "화(火) 기운이 강한 분야"
        ],
        "description": "대해지수의 기운으로 깊은 사고와 통찰이 필요한 분야에 적합합니다. 학술, 연구, 예술, 철학 분야에서 재능을 발휘하며, 물과 관련된 무역, 물류 분야에서도 성공할 수 있습니다."
      },
      "relationship": {
        "traits": [
          "포용력 있는 태도",
          "깊은 이해와 공감",
          "때로는 냉정해 보일 수 있음",
          "소수와 깊은 관계 선호"
        ],
        "description": "임자일주는 바다처럼 넓은 포용력으로 주변을 감싸 안습니다. 깊이 있는 대화와 관계를 선호하며, 표면적인 교류보다 진정한 연결을 중시합니다. 수기가 강해 차가워 보일 수 있으니 따뜻함을 표현하는 노력이 필요합니다."
      },
      "advice": {
        "leverageStrength": "깊은 사고력과 직관력을 활용하여 전문 분야에서 권위자로 성장하세요. 포용력으로 주변을 이끄는 리더가 될 수 있습니다.",
        "caution": "물의 기운이 과하면 우울감이나 감정 기복이 생길 수 있습니다. 활동적인 취미와 사람들과의 교류로 균형을 맞추세요.",
        "action": "화(火)와 목(木) 기운을 보완하면 좋습니다. 따뜻한 색상, 햇빛을 쬐는 활동, 식물 가꾸기 등이 도움됩니다."
      },
      "meta": {
        "polarity": "yang",
        "stemElement": "수",
        "branchElement": "수",
        "branchTenGod": "양인"
      }
    },
    "무술": {
      "name": "무술",
      "hanja": "戊戌",
      "stem": "무",
      "branch": "술",
      "keywords": [
        {